{
  "output_schema_version": "1.0",
  "article_id": "394e97c0b2affd4baaea72286f97041b873976afdc771e7c7a1f6931f1770b00",
  "summary": {
    "abstractive": "Công ty của nữ đại gia Chu Thị Thành bán 153 hóa đơn khống, trị giá hơn 841 tỷ đồng Giai đoạn 2020-2022, Công ty Thiên Minh Đức của nữ đại gia Chu Thị Thành xuất khống 153 hóa đơn, tương ứng hơn 72 triệu lít xăng dầu, trị giá trên 841 tỷ đồng cho nhiều doanh nghiệp.",
    "key_points": [
      "Giai đoạn 2020-2022, Công ty Thiên Minh Đức của nữ đại gia Chu Thị Thành xuất khống 153 hóa đơn, tương ứng hơn 72 triệu lít xăng dầu, trị giá trên 841 tỷ đồng cho nhiều doanh nghiệp.",
      "Như VietNamNet đã đưa tin, VKSND tối cao đã ban hành cáo trạng truy tố bị can Chu Thị Thành (Chủ tịch HĐQT Công ty CP Tập đoàn Thiên Minh Đức - Công ty Thiên Minh Đức) về tội Tham ô tài sản và Mua bán",
      "Đầu năm 2020, khi việc kinh doanh gặp khó khăn do ảnh hưởng của dịch Covid-19, bà Chu Thị Thành chỉ đạo cấp dưới bán xăng dầu không xuất hóa đơn giá trị gia tăng (GTGT) với giá thấp hơn giá bán xuất h",
      "Mục đích của việc này nhằm thu được tiền nhanh để đầu tư cho các dự án của công ty, lại vừa không phải trích lập Quỹ BOG tại thời điểm có mức trích quỹ cao. Sau đó, các bị can tìm khách hàng có nhu cầ"
    ]
  },
  "implication": {
    "text": "Nội dung bài viết tác động tới nhận định thị trường và hoạt động kinh doanh của các đơn vị liên quan.",
    "affected_parties": [
      "nhà đầu tư",
      "doanh nghiệp niêm yết"
    ],
    "impact_area": "market"
  },
  "materiality": {
    "score": 0.65,
    "time_sensitivity": "this_week"
  },
  "confidence": 0.88,
  "citations": [
    {
      "claim": "Thông tin chính được trích xuất từ bài viết: Công ty của nữ đại gia Chu Thị Thành bán 153 hóa đ...",
      "source_span": "Công ty của nữ đại gia Chu Thị Thành bán 153 hóa đơn khống, trị giá hơn 841 tỷ đồng",
      "source_offset": 0
    },
    {
      "claim": "Thông tin chính được trích xuất từ bài viết: Giai đoạn 2020-2022, Công ty Thiên Minh Đức của nữ...",
      "source_span": "Giai đoạn 2020-2022, Công ty Thiên Minh Đức của nữ đại gia Chu Thị Thành xuất khống 153 hóa đơn, tương ứng hơn 72 triệu lít xăng dầu, trị giá trên 841 tỷ đồng cho nhiều doanh nghiệp.",
      "source_offset": 84
    },
    {
      "claim": "Thông tin chính được trích xuất từ bài viết: Như VietNamNet đã đưa tin, VKSND tối cao đã ban hà...",
      "source_span": "Như VietNamNet đã đưa tin, VKSND tối cao đã ban hành cáo trạng truy tố bị can Chu Thị Thành (Chủ tịch HĐQT Công ty CP Tập đoàn Thiên Minh Đức - Công ty Thiên Minh Đức) về tội Tham ô tài sản và Mua bán trái phép hóa đơn, chứng từ thu nộp ngân sách nhà nước.",
      "source_offset": 267
    }
  ],
  "processing_metadata": {
    "agent_provider": "gemini",
    "model_used": "gemini-3.7-flash",
    "timestamp": "2026-08-20T14:37:35.755748+07:00",
    "schema_version": "1.0"
  },
  "sentiment": {
    "overall": 0.0,
    "polarity": "neutral"
  },
  "event_type": "macro",
  "extraction_quality": "high"
}