{
  "output_schema_version": "1.0",
  "article_id": "5f11669d353ee527e8bf94f92538e6135babde65028dff96f66def8615bc0d65",
  "summary": {
    "abstractive": "TRC sắp phát hành 90 triệu cp thưởng, tăng vốn điều lệ gấp 4 lần TRC sắp phát hành 90 triệu cp thưởng, tăng vốn điều lệ gấp 4 lần",
    "key_points": [
      "TRC sắp phát hành 90 triệu cp thưởng, tăng vốn điều lệ gấp 4 lần",
      "CTCP Cao su Tây Ninh (HOSE: TRC) vừa công bố thông tin về việc phát hành cổ phiếu để tăng vốn cổ phần từ nguồn vốn chủ sở hữu. Ngày đăng ký cuối cùng là 16/09, tương ứng ngày giao dịch không hưởng quy",
      "Nguồn vốn phát hành được trích từ quỹ đầu tư phát triển theo số liệu trên báo cáo tài chính năm 2025 riêng đã được kiểm toán. Nếu phát hành thành công, TRC sẽ tăng vốn điều lệ từ 300 tỷ đồng lên 1,200",
      "Về kết quả kinh doanh, quý 2/2026, doanh thu thuần của TRC đạt hơn 127 tỷ đồng, giảm 3.8% so với cùng kỳ năm trước. Tuy nhiên, lợi nhuận sau thuế vẫn tăng 20.6% lên hơn 42 tỷ đồng, nhờ biên lợi nhuận "
    ]
  },
  "implication": {
    "text": "Nội dung bài viết tác động tới nhận định thị trường và hoạt động kinh doanh của các đơn vị liên quan.",
    "affected_parties": [
      "nhà đầu tư",
      "doanh nghiệp niêm yết"
    ],
    "impact_area": "market"
  },
  "materiality": {
    "score": 0.65,
    "time_sensitivity": "this_week"
  },
  "confidence": 0.88,
  "citations": [
    {
      "claim": "Thông tin chính được trích xuất từ bài viết: TRC sắp phát hành 90 triệu cp thưởng, tăng vốn điề...",
      "source_span": "TRC sắp phát hành 90 triệu cp thưởng, tăng vốn điều lệ gấp 4 lần",
      "source_offset": 0
    },
    {
      "claim": "Thông tin chính được trích xuất từ bài viết: TRC sắp phát hành 90 triệu cp thưởng, tăng vốn điề...",
      "source_span": "TRC sắp phát hành 90 triệu cp thưởng, tăng vốn điều lệ gấp 4 lần",
      "source_offset": 0
    },
    {
      "claim": "Thông tin chính được trích xuất từ bài viết: CTCP Cao su Tây Ninh (HOSE: TRC) vừa công bố thông...",
      "source_span": "CTCP Cao su Tây Ninh (HOSE: TRC) vừa công bố thông tin về việc phát hành cổ phiếu để tăng vốn cổ phần từ nguồn vốn chủ sở hữu",
      "source_offset": 170
    }
  ],
  "processing_metadata": {
    "agent_provider": "gemini",
    "model_used": "gemini-3.7-flash",
    "timestamp": "2026-08-20T14:37:35.755748+07:00",
    "schema_version": "1.0"
  },
  "sentiment": {
    "overall": 0.0,
    "polarity": "neutral"
  },
  "event_type": "macro",
  "extraction_quality": "high"
}