{
  "output_schema_version": "1.0",
  "article_id": "8f38cc5b760f32b76763ab198e47fa9c55acdb2159d64766707ae96376221a2f",
  "summary": {
    "abstractive": "Cổ phiếu SSB của SeABank được lựa chọn vào rổ MSCI Frontier Markets Index Ngày 13/08/2026, MSCI (Morgan Stanley Capital International) công bố kết quả kỳ rà soát tháng 8/2026, trong đó chính thức bổ sung cổ phiếu SSB của Ngân hàng TMCP Đông Nam Á (SeABank, HOSE: SSB) vào rổ Frontier Markets Index. Thay đổi sẽ có hiệu lực kể từ ngày 1/9/2026.",
    "key_points": [
      "Ngày 13/08/2026, MSCI (Morgan Stanley Capital International) công bố kết quả kỳ rà soát tháng 8/2026, trong đó chính thức bổ sung cổ phiếu SSB của Ngân hàng TMCP Đông Nam Á (SeABank, HOSE: SSB) vào rổ",
      "MSCI Frontier Markets Index là chỉ số do MSCI xây dựng nhằm đo lường diễn biến của các cổ phiếu tại các thị trường cận biên. Việc lựa chọn và duy trì thành phần trong chỉ số được thực hiện dựa trên cá",
      "Bộ chỉ số này được nhiều nhà đầu tư tổ chức và các quỹ đầu tư quốc tế sử dụng làm chỉ số tham chiếu (benchmark) trong quá trình đánh giá thị trường và phân bổ tài sản. Thay đổi thành phần chỉ số thườn",
      "Kết quả kỳ rà soát tháng 8/2026 vừa công bố, MSCI Frontier Markets Index bổ sung 6 cổ phiếu và loại 5 cổ phiếu. Trong đó, Việt Nam tiếp tục là thị trường có tỷ trọng lớn nhất trong MSCI Frontier Marke"
    ]
  },
  "implication": {
    "text": "Nội dung bài viết tác động tới nhận định thị trường và hoạt động kinh doanh của các đơn vị liên quan.",
    "affected_parties": [
      "nhà đầu tư",
      "doanh nghiệp niêm yết"
    ],
    "impact_area": "market"
  },
  "materiality": {
    "score": 0.65,
    "time_sensitivity": "this_week"
  },
  "confidence": 0.88,
  "citations": [
    {
      "claim": "Thông tin chính được trích xuất từ bài viết: Cổ phiếu SSB của SeABank được lựa chọn vào rổ MSCI...",
      "source_span": "Cổ phiếu SSB của SeABank được lựa chọn vào rổ MSCI Frontier Markets Index",
      "source_offset": 0
    },
    {
      "claim": "Thông tin chính được trích xuất từ bài viết: Ngày 13/08/2026, MSCI (Morgan Stanley Capital Inte...",
      "source_span": "Ngày 13/08/2026, MSCI (Morgan Stanley Capital International) công bố kết quả kỳ rà soát tháng 8/2026, trong đó chính thức bổ sung cổ phiếu SSB của Ngân hàng TMCP Đông Nam Á (SeABank, HOSE: SSB) vào rổ Frontier Markets Index",
      "source_offset": 74
    },
    {
      "claim": "Thông tin chính được trích xuất từ bài viết: Thay đổi sẽ có hiệu lực kể từ ngày 1/9/2026....",
      "source_span": "Thay đổi sẽ có hiệu lực kể từ ngày 1/9/2026.",
      "source_offset": 299
    }
  ],
  "processing_metadata": {
    "agent_provider": "gemini",
    "model_used": "gemini-3.7-flash",
    "timestamp": "2026-08-20T14:37:35.755748+07:00",
    "schema_version": "1.0"
  },
  "sentiment": {
    "overall": 0.0,
    "polarity": "neutral"
  },
  "event_type": "macro",
  "extraction_quality": "high"
}